{"$schema":"https://json-schema.org/draft/2020-12/schema","$id":"https://example.invalid/schemas/v4/consumer_chunk.schema.json","title":"Consumer v4 chunk","type":"object","additionalProperties":false,"required":["consumer_contract_version","chunk_version","generation_id","package","part","part_count","fragment","fragment_byte_length","fragment_sha256"],"properties":{"consumer_contract_version":{"const":"4.0"},"chunk_version":{"const":"1.0"},"generation_id":{"type":"string","pattern":"^[0-9a-f]{64}$"},"package":{"type":"string","minLength":1},"part":{"type":"integer","minimum":1,"maximum":32},"part_count":{"type":"integer","minimum":1,"maximum":32},"fragment":{"type":"string"},"fragment_byte_length":{"type":"integer","minimum":0},"fragment_sha256":{"type":"string","pattern":"^[0-9a-f]{64}$"}}}