{
  "consumer_contract_version": "4.0",
  "chunk_version": "1.0",
  "generation_id": "36c2239acd07a38c378706b5f81faa2904e3cf81d42fd36859c4c27ba328d869",
  "package": "blind",
  "part": 5,
  "part_count": 5,
  "fragment": "08191476807,\"market_cap_led\":null,\"market_cap_weight_rel_spy_4w\":null,\"median_rel_spy_4w\":-0.11475363076244272,\"pct_above_50dma\":0.14285714285714285,\"pct_within_5pct_52w_high\":0.0,\"single_name_concentrated\":true,\"top1_contribution_ratio\":0.6381845814035357,\"top3_contribution_ratio\":1.0,\"unique_constituent_count\":7,\"volume_ratio_20d_60d\":0.8841947221649732,\"weighting_divergence_4w\":null,\"winsorized_equal_weight_rel_spy_4w\":-0.06984098503624547},\"quality\":{\"classification_eligible\":true,\"constituent_count\":7,\"coverage_ratio\":1.0,\"direction_eligible\":false,\"evidence_eligible\":true,\"history_weeks\":1,\"metric_valid_counts\":{\"above_50dma\":7,\"market_cap\":0,\"return_13w\":7,\"return_4w\":7,\"within_5pct_52w_high\":7},\"missing_required_fields\":[],\"phase_initial_diffusion_eligible\":false,\"phase_overheat_eligible\":true,\"quality_reasons\":[\"Q_HISTORY_BELOW_3\",\"Q_MARKET_CAP_COVERAGE_BELOW_075\"],\"role_valid_counts\":{\"beneficiary\":2,\"core\":3,\"peripheral\":2},\"valid_constituent_count\":7},\"structural_context\":{\"as_of\":\"2026-07-15\",\"source_category\":[\"repository_theme_master\"],\"status\":\"not_assessed\",\"summary\":\"固定テーマとしての構成管理はありますが、長期材料を裏付ける根拠は未評価です。\",\"version\":\"1.0\"},\"theme_id\":\"nuclear_uranium\",\"trends\":{\"above_50dma_breadth_trend_3w\":\"insufficient\",\"above_50dma_count_change_1w\":null,\"above_50dma_count_change_3w\":null,\"advance_breadth_trend_3w\":\"insufficient\",\"advance_count_change_1w\":null,\"advance_count_change_3w\":null,\"rel_spy_4w_change_1w\":null,\"rel_spy_4w_slope_3w\":null,\"rel_spy_4w_slope_4w\":null,\"rel_spy_4w_trend_3w\":\"insufficient\",\"rel_spy_4w_trend_4w\":\"insufficient\",\"volume_ratio_change_1w\":null}},{\"classifications_observed\":{\"direction\":\"unclassifiable\",\"evidence\":{\"direct_flow_data_available\":false,\"direction\":\"outflow\",\"level\":\"relative_preference_suggested\",\"matched_conditions\":[\"EV_DIRECTION_OUTFLOW\"],\"positioning_hypothesis\":\"not_assessable\"},\"phase\":\"unclassifiable\"},\"constituents\":[{\"dollar_volume_20d\":60753093.57475281,\"market_cap\":null,\"overlap_theme_count\":1,\"positive_contribution_ratio\":null,\"rel_spy_4w\":-0.27058649756492603,\"return_4w\":-0.2688835106594615,\"role\":\"peripheral\",\"ticker\":\"ACLS\",\"valid\":true},{\"dollar_volume_20d\":4601152503.897705,\"market_cap\":null,\"overlap_theme_count\":1,\"positive_contribution_ratio\":null,\"rel_spy_4w\":-0.2217640792633031,\"return_4w\":-0.22006109235783855,\"role\":\"core\",\"ticker\":\"AMAT\",\"valid\":true},{\"dollar_volume_20d\":3482383117.897339,\"market_cap\":null,\"overlap_theme_count\":1,\"positive_contribution_ratio\":null,\"rel_spy_4w\":-0.11669413036275456,\"return_4w\":-0.11499114345729,\"role\":\"core\",\"ticker\":\"ASML\",\"valid\":true},{\"dollar_volume_20d\":2621722623.4253693,\"market_cap\":null,\"overlap_theme_count\":1,\"positive_contribution_ratio\":null,\"rel_spy_4w\":-0.3149003059352764,\"return_4w\":-0.31319731902981185,\"role\":\"core\",\"ticker\":\"KLAC\",\"valid\":true},{\"dollar_volume_20d\":3676480682.478943,\"market_cap\":null,\"overlap_theme_count\":1,\"positive_contribution_ratio\":null,\"rel_spy_4w\":-0.25278926789493106,\"return_4w\":-0.2510862809894665,\"role\":\"core\",\"ticker\":\"LRCX\",\"valid\":true},{\"dollar_volume_20d\":330319059.5541382,\"market_cap\":null,\"overlap_theme_count\":1,\"positive_contribution_ratio\":null,\"rel_spy_4w\":-0.2657626483562795,\"return_4w\":-0.26405966145081494,\"role\":\"beneficiary\",\"ticker\":\"ONTO\",\"valid\":true},{\"dollar_volume_20d\":1353256970.0236511,\"market_cap\":null,\"overlap_theme_count\":1,\"positive_contribution_ratio\":null,\"rel_spy_4w\":-0.1412873796785672,\"return_4w\":-0.13958439277310264,\"role\":\"beneficiary\",\"ticker\":\"TER\",\"valid\":true}],\"description\":null,\"display_name\":\"半導体製造装置\",\"metrics\":{\"above_50dma_count\":0,\"advance_count_4w\":0,\"advance_ratio_4w\":0.0,\"contribution_hhi\":null,\"effective_contributor_count\":null,\"equal_weight_led\":null,\"equal_weight_rel_spy_13w\":0.027774522760727782,\"equal_weight_rel_spy_1w\":-0.057386466189348874,\"equal_weight_rel_spy_4w\":-0.2262549012937197,\"equal_weight_rel_spy_previous_3w\":-0.07685561477776916,\"equal_weight_rel_spy_previous_9w\":0.19348356264457017,\"equal_weight_return_13w\":0.06992878540576775,\"equal_weight_return_1w\":-0.04642462041047838,\"equal_weight_return_4w\":-0.22455191438825514,\"liquidity_weight_rel_spy_4w\":-0.215621296505485,\"market_cap_led\":null,\"market_cap_weight_rel_spy_4w\":null,\"median_rel_spy_4w\":-0.25278926789493106,\"pct_above_50dma\":0.0,\"pct_within_5pct_52w_high\":0.0,\"single_name_concentrated\":null,\"top1_contribution_ratio\":null,\"top3_contribution_ratio\":null,\"unique_constituent_count\":7,\"volume_ratio_20d_60d\":0.9021041342085818,\"weighting_divergence_4w\":null,\"winsorized_equal_weight_rel_spy_4w\":-0.22343767857164284},\"quality\":{\"classification_eligible\":true,\"constituent_count\":7,\"coverage_ratio\":1.0,\"direction_eligible\":false,\"evidence_eligible\":true,\"history_weeks\":1,\"metric_valid_counts\":{\"above_50dma\":7,\"market_cap\":0,\"return_13w\":7,\"return_4w\":7,\"within_5pct_52w_high\":7},\"missing_required_fields\":[],\"phase_initial_diffusion_eligible\":false,\"phase_overheat_eligible\":true,\"quality_reasons\":[\"Q_HISTORY_BELOW_3\",\"Q_ROLE_PERIPHERAL_BELOW_2\",\"Q_MARKET_CAP_COVERAGE_BELOW_075\"],\"role_valid_counts\":{\"beneficiary\":2,\"core\":4,\"peripheral\":1},\"valid_constituent_count\":7},\"structural_context\":{\"as_of\":\"2026-07-15\",\"source_category\":[\"repository_theme_master\"],\"status\":\"not_assessed\",\"summary\":\"固定テーマとしての構成管理はありますが、長期材料を裏付ける根拠は未評価です。\",\"version\":\"1.0\"},\"theme_id\":\"semi_equipment\",\"trends\":{\"above_50dma_breadth_trend_3w\":\"insufficient\",\"above_50dma_count_change_1w\":null,\"above_50dma_count_change_3w\":null,\"advance_breadth_trend_3w\":\"insufficient\",\"advance_count_change_1w\":null,\"advance_count_change_3w\":null,\"rel_spy_4w_change_1w\":null,\"rel_spy_4w_slope_3w\":null,\"rel_spy_4w_slope_4w\":null,\"rel_spy_4w_trend_3w\":\"insufficient\",\"rel_spy_4w_trend_4w\":\"insufficient\",\"volume_ratio_change_1w\":null}}]}",
  "fragment_byte_length": 5909,
  "fragment_sha256": "baa570d70749fb12be59c29b21fb092b8bf4b132e2c3b12d4d327de93ef7bd3b"
}
