{
  "consumer_contract_version": "4.0",
  "chunk_version": "1.0",
  "generation_id": "6df6bad82c5e2d0b0cd0c7cf14d597f10416fff5cc750893dd1f3a08413a4848",
  "package": "blind",
  "part": 2,
  "part_count": 5,
  "fragment": ",\"market_cap\":null,\"overlap_theme_count\":1,\"positive_contribution_ratio\":0.0,\"rel_spy_4w\":-0.02821412072406948,\"return_4w\":-0.026511133818604926,\"role\":\"peripheral\",\"ticker\":\"AI\",\"valid\":true},{\"dollar_volume_20d\":1084088118.0322266,\"market_cap\":null,\"overlap_theme_count\":1,\"positive_contribution_ratio\":0.029476403941766642,\"rel_spy_4w\":0.011492680401715916,\"return_4w\":0.01319566730718047,\"role\":\"beneficiary\",\"ticker\":\"DDOG\",\"valid\":true},{\"dollar_volume_20d\":428261220.4173279,\"market_cap\":null,\"overlap_theme_count\":1,\"positive_contribution_ratio\":0.0,\"rel_spy_4w\":-0.06264125169185852,\"return_4w\":-0.06093826478639397,\"role\":\"peripheral\",\"ticker\":\"MDB\",\"valid\":true},{\"dollar_volume_20d\":14706494834.525604,\"market_cap\":null,\"overlap_theme_count\":1,\"positive_contribution_ratio\":0.5325124773064013,\"rel_spy_4w\":0.2076235528492243,\"return_4w\":0.20932653975468885,\"role\":\"beneficiary\",\"ticker\":\"MSFT\",\"valid\":true},{\"dollar_volume_20d\":2561573164.978752,\"market_cap\":null,\"overlap_theme_count\":1,\"positive_contribution_ratio\":0.12726595978691765,\"rel_spy_4w\":0.04962026591636581,\"return_4w\":0.05132325282183037,\"role\":\"beneficiary\",\"ticker\":\"NOW\",\"valid\":true},{\"dollar_volume_20d\":4407248710.090256,\"market_cap\":null,\"overlap_theme_count\":2,\"positive_contribution_ratio\":0.0,\"rel_spy_4w\":-0.02293901432176859,\"return_4w\":-0.021236027416304037,\"role\":\"core\",\"ticker\":\"PLTR\",\"valid\":true},{\"dollar_volume_20d\":1282781187.7752686,\"market_cap\":null,\"overlap_theme_count\":1,\"positive_contribution_ratio\":0.3107451589649144,\"rel_spy_4w\":0.12115775063401868,\"return_4w\":0.12286073753948323,\"role\":\"core\",\"ticker\":\"SNOW\",\"valid\":true}],\"description\":null,\"display_name\":\"AIソフトウェア・データ基盤\",\"metrics\":{\"above_50dma_count\":5,\"advance_count_4w\":4,\"advance_ratio_4w\":0.5714285714285714,\"contribution_hhi\":0.39719757521695404,\"effective_contributor_count\":2.5176387329499383,\"equal_weight_led\":null,\"equal_weight_rel_spy_13w\":0.3646398431568424,\"equal_weight_rel_spy_1w\":0.10079572842832467,\"equal_weight_rel_spy_4w\":0.0394428375805183,\"equal_weight_rel_spy_previous_3w\":-0.05276208837150282,\"equal_weight_rel_spy_previous_9w\":0.3052466127355172,\"equal_weight_return_13w\":0.40679410580188236,\"equal_weight_return_1w\":0.11175757420719516,\"equal_weight_return_4w\":0.041145824485982856,\"liquidity_weight_rel_spy_4w\":0.1313009418696518,\"market_cap_led\":null,\"market_cap_weight_rel_spy_4w\":null,\"median_rel_spy_4w\":0.011492680401715916,\"pct_above_50dma\":0.7142857142857143,\"pct_within_5pct_52w_high\":0.2857142857142857,\"single_name_concentrated\":false,\"top1_contribution_ratio\":0.5325124773064013,\"top3_contribution_ratio\":0.9705235960582334,\"unique_constituent_count\":7,\"volume_ratio_20d_60d\":0.7730513074087936,\"weighting_divergence_4w\":null,\"winsorized_equal_weight_rel_spy_4w\":0.032008741688030216},\"quality\":{\"classification_eligible\":true,\"constituent_count\":7,\"coverage_ratio\":1.0,\"direction_eligible\":false,\"evidence_eligible\":true,\"history_weeks\":1,\"metric_valid_counts\":{\"above_50dma\":7,\"market_cap\":0,\"return_13w\":7,\"return_4w\":7,\"within_5pct_52w_high\":7},\"missing_required_fields\":[],\"phase_initial_diffusion_eligible\":false,\"phase_overheat_eligible\":true,\"quality_reasons\":[\"Q_HISTORY_BELOW_3\",\"Q_MARKET_CAP_COVERAGE_BELOW_075\"],\"role_valid_counts\":{\"beneficiary\":3,\"core\":2,\"peripheral\":2},\"valid_constituent_count\":7},\"structural_context\":{\"as_of\":\"2026-07-15\",\"source_category\":[\"repository_theme_master\"],\"status\":\"not_assessed\",\"summary\":\"固定テーマとしての構成管理はありますが、長期材料を裏付ける根拠は未評価です。\",\"version\":\"1.0\"},\"theme_id\":\"ai_software_data\",\"trends\":{\"above_50dma_breadth_trend_3w\":\"insufficient\",\"above_50dma_count_change_1w\":null,\"above_50dma_count_change_3w\":null,\"advance_breadth_trend_3w\":\"insufficient\",\"advance_count_change_1w\":null,\"advance_count_change_3w\":null,\"rel_spy_4w_change_1w\":null,\"rel_spy_4w_slope_3w\":null,\"rel_spy_4w_slope_4w\":null,\"rel_spy_4w_trend_3w\":\"insufficient\",\"rel_spy_4w_trend_4w\":\"insufficient\",\"volume_ratio_change_1w\":null}},{\"classifications_observed\":{\"direction\":\"unclassifiable\",\"evidence\":{\"direct_flow_data_available\":false,\"direction\":\"inflow\",\"level\":\"relative_preference_suggested\",\"matched_conditions\":[\"EV_REL_POS\",\"EV_ADVANCE_60\",\"EV_TOP1_50\"],\"positioning_hypothesis\":\"not_supported\"},\"phase\":\"unclassifiable\"},\"constituents\":[{\"dollar_volume_20d\":1632160752.1819305,\"market_cap\":null,\"overlap_theme_count\":1,\"positive_contribution_ratio\":0.0,\"rel_spy_4w\":-0.013738067153023614,\"return_4w\":-0.01203508024755906,\"role\":\"core\",\"ticker\":\"CRWD\",\"valid\":true},{\"dollar_volume_20d\":860528546.428833,\"market_cap\":null,\"overlap_theme_count\":1,\"positive_contribution_ratio\":0.06305320976261526,\"rel_spy_4w\":0.01697861644413634,\"return_4w\":0.018681603349600895,\"role\":\"core\",\"ticker\":\"FTNT\",\"valid\":true},{\"dollar_volume_20d\":827189464.9378204,\"market_cap\":null,\"overlap_theme_count\":1,\"positive_contribution_ratio\":0.4862504288413052,\"rel_spy_4w\":0.13093480186298612,\"return_4w\":0.13263778876845067,\"role\":\"beneficiary\",\"ticker\":\"NET\",\"valid\":true},{\"dollar_volume_20d\":411653713.65478516,\"market_cap\":null,\"overlap_theme_count\":1,\"positive_contribution_ratio\":0.03254124791787,\"rel_spy_4w\":0.00876252563654023,\"return_4w\":0.010465512542004785,\"role\":\"beneficiary\",\"ticker\":\"OKTA\",\"valid\":true},{\"dollar_volume_20d\":2213652443.524475,\"market_cap\":null,\"overlap_theme_count\":1,\"positive_contribution_ratio\":0.0,\"rel_spy_4w\":-0.05911129698984907,\"return_4w\":-0.05740831008438452,\"role\":\"core\",\"ticker\":\"PANW\",\"valid\":true},{\"dollar_volume_20d\":134493362.44542122,\"market_cap\":null,\"overlap_theme_count\":1,\"positive_contribution_ratio\":0.30402881897058204,\"rel_spy_4w\":0.0818671836802487,\"return_4w\":0.08357017058571325,\"role\":\"peripheral\",\"ticker\":\"S\",\"valid\":true},{\"dollar_volume_20d\":349516173.877182,\"market_cap\":null,\"overlap_theme_count\":1,\"positive_contribution_ratio\":0.11412629450762753,\"rel_spy_4w\":0.030731291680957895,\"return_4w\":0.03243427858642245,\"role\":\"core\",\"ticker\":\"ZS\",\"valid\":true}],\"description\":null,\"display_name\":\"サイバーセキュリティ\",\"metrics\":{\"above_50dma_count\":7,\"advance_count_4w\":5,\"advance_ratio_4w\":0.7142857142857143,\"contribution_hhi\":0.3469324534884625,\"effective_contributor_count\":2.8824054652277025,\"equal_weight_led\":null,\"equal_weight_rel_spy_13w\":0.5686059458574915,\"equal_weight_rel_spy_1w\":0.03634358902916029,\"equal_weight_rel_spy_4w\":0.028060722165999512,\"equal_weight_rel_spy_previous_3w\":-0.0045685674734484705,\"equal_weight_rel_spy_previous_9w\":0.5326705933185362,\"equal_weight_return_13w\":0.6107602085025314,\"equal_weight_return_1w\":0.04730543480803078,\"equal_weight_return_4w\":0.029763709071464067,\"liquidity_weight_rel_spy_4w\":-0.0007772864448319807,\"market_cap_led\":null,\"market_cap_weight_rel_spy_4w\":null,\"median_rel_spy_4w\":0.01697861644413634,\"pct_above_50dma\":1.0,\"pct_within_5pct_52w_high\":0.42857142857142855,\"single_name_concentrated\":false,\"top1_contribution_ratio\":0.4862504288413052,\"top3_contribution_ratio\":0.9044055423195148,\"unique_constituent_count\":7,\"volume_ratio_20d_60d\":0.7563364487929443,\"weighting_divergence_4w\":null,\"winsorized_equal_weight_rel_spy_4w\":0.027532952402297806},\"quality\":{\"classification_eligible\":true,\"constituent_count\":7,\"coverage_ratio\":1.0,\"direction_eligible\":false,\"evidence_eligible\":true,\"history_weeks\":1,\"metric_valid_counts\":{\"above_50dma\":7,\"market_cap\":0,\"return_13w\":7,\"return_4w\":7,\"within_5pct_52w_high\":7},\"missing_required_fields\":[],\"phase_initial_diffusion_eligible\":false,\"phase_overheat_eligible\":true,\"quality_reasons\":[\"Q_HISTORY_BELOW_3\",\"Q_ROLE_PERIPHERAL_BELOW_2\",\"Q_MARKET_CAP_COVERAGE_BELOW_075\"],\"role_valid_counts\":{\"beneficiary\":2,\"core\":4,\"peripheral\":1},\"valid_constituent_count\":7},\"structural_context\":{\"as_of\":\"2026-07-15\",\"source_category\":[\"repository_theme_master\"],\"status\":\"not_assessed\",\"summary\":\"固定テーマとしての構成管理はありますが、長期材料を裏付ける根拠は未評価です。\",\"version\":\"1.0\"},\"theme_id\":\"cybersecurity\",\"trends\":{\"above_50dma_breadth_trend_3w\":\"insufficient\",\"above_50dma_count_change_1w\":null,\"above_50dma_count_change_3w\":null,\"advance_breadth_trend_3w\":\"insuff",
  "fragment_byte_length": 8192,
  "fragment_sha256": "c302a7f96841ee7434acfa2322b7099007964d2b7ff6a5b2315c254fb166e86f"
}
