{
  "consumer_contract_version": "4.0",
  "chunk_version": "1.0",
  "generation_id": "6c2260ba8b98d8fccd20d14e35fb616ff40e1d7bc1d7af296cf514e962deffa0",
  "package": "mechanical",
  "part": 1,
  "part_count": 3,
  "fragment": "{\"analysis_id\":\"3c07b5c0e7a3ed0c8aabcce577be51f4906abff8755f2e1f16305b55a043dbdb\",\"artifact_type\":\"MECHANICAL_SIGNALS\",\"company_candidate_ids\":[\"oil_gas_exploration:COP\",\"oil_gas_exploration:OXY\"],\"company_candidate_set_identity\":\"e43a017d975e730cfdf837be4f59bac3d25c26f3bf9ff0e5568566977a479144\",\"consumer_contract_version\":\"4.0\",\"data_date\":\"2026-07-31\",\"disclosure_stage\":\"reconciliation\",\"generated_at\":\"2026-08-03T11:55:38.864564Z\",\"generation_id\":\"6c2260ba8b98d8fccd20d14e35fb616ff40e1d7bc1d7af296cf514e962deffa0\",\"signals\":[{\"candidate_bucket\":\"avoid_now\",\"fundamental_confirmation\":null,\"fundamental_gate\":{\"missing_fields\":[\"fundamental_confirmation\"],\"reason_code\":\"FUNDAMENTAL_CONFIRMATION_MISSING\",\"status\":\"not_evaluable\"},\"hard_exclusion\":true,\"hard_exclusion_reason\":\"avoid_now\",\"machine_reason_components\":{\"condition_flags\":{\"broad_concentration_pass\":false,\"contrary_evidence\":[],\"direction_improving\":null,\"direction_outflow_signal\":null,\"direction_worsening\":null,\"matched_conditions\":[\"PH_INITIAL_REL1_POS\",\"PH_INITIAL_REL4_POS\"],\"overheat_breadth_weak\":false,\"phase_diffusion\":null,\"phase_initial\":null,\"phase_price_overheat\":false,\"unmatched_conditions\":[]},\"decision\":{\"analysis_mode\":\"initial_observation\",\"candidate_bucket\":\"avoid_now\",\"direct_flow_confirmation\":\"unavailable\",\"price_preference\":\"positive\",\"time_profile\":\"mixed\",\"weeks_until_trend\":2},\"quality\":{\"classification_eligible\":true,\"constituent_count\":7,\"coverage_ratio\":1.0,\"direction_eligible\":false,\"evidence_eligible\":true,\"history_weeks\":1,\"metric_valid_counts\":{\"above_50dma\":7,\"market_cap\":0,\"return_13w\":7,\"return_4w\":7,\"within_5pct_52w_high\":7},\"missing_required_fields\":[],\"phase_initial_diffusion_eligible\":false,\"phase_overheat_eligible\":true,\"quality_reasons\":[\"Q_HISTORY_BELOW_3\",\"Q_MARKET_CAP_COVERAGE_BELOW_075\"],\"role_valid_counts\":{\"beneficiary\":3,\"core\":2,\"peripheral\":2},\"valid_constituent_count\":7}},\"mechanical_priority\":\"watch\",\"mechanical_rank\":1,\"monitoring_status\":\"excluded\",\"price_confirmation\":{\"breadth_gate\":{\"missing_fields\":[],\"observed_values\":{\"advance_ratio_4w\":0.5714285714285714,\"pct_above_50dma\":0.7142857142857143},\"reason_code\":\"BREADTH_BELOW_THRESHOLD\",\"required_operator\":\">= for both\",\"required_values\":{\"advance_ratio_4w\":0.6,\"pct_above_50dma\":0.5},\"status\":\"fail\"},\"breadth_pass\":false,\"data_available\":true,\"missing_fields\":[],\"quality_gate\":{\"missing_fields\":[],\"observed_value\":true,\"reason_code\":\"PASS\",\"required_operator\":\"is\",\"required_value\":true,\"status\":\"pass\"},\"quality_pass\":true,\"relative_gate\":{\"difference\":-0.010557162419481701,\"missing_fields\":[],\"observed_value\":0.0394428375805183,\"reason_code\":\"RELATIVE_BELOW_THRESHOLD\",\"required_operator\":\">=\",\"required_value\":0.05,\"status\":\"fail\"},\"relative_threshold_pass\":false,\"status\":\"fail\"},\"selection_eligible\":false,\"selection_gate_reasons\":[\"HARD_EXCLUSION\",\"RELATIVE_RELATIVE_BELOW_THRESHOLD\",\"BREADTH_BREADTH_BELOW_THRESHOLD\",\"FUNDAMENTAL_FUNDAMENTAL_CONFIRMATION_MISSING\",\"CANDIDATE_BUCKET_AVOID_NOW\"],\"selection_gate_status\":\"fail\",\"theme_id\":\"ai_software_data\"},{\"candidate_bucket\":\"avoid_now\",\"fundamental_confirmation\":null,\"fundamental_gate\":{\"missing_fields\":[\"fundamental_confirmation\"],\"reason_code\":\"FUNDAMENTAL_CONFIRMATION_MISSING\",\"status\":\"not_evaluable\"},\"hard_exclusion\":true,\"hard_exclusion_reason\":\"avoid_now\",\"machine_reason_components\":{\"condition_flags\":{\"broad_concentration_pass\":false,\"contrary_evidence\":[],\"direction_improving\":null,\"direction_outflow_signal\":null,\"direction_worsening\":null,\"matched_conditions\":[],\"overheat_breadth_weak\":null,\"phase_diffusion\":null,\"phase_initial\":null,\"phase_price_overheat\":null,\"unmatched_conditions\":[]},\"decision\":{\"analysis_mode\":\"initial_observation\",\"candidate_bucket\":\"avoid_now\",\"direct_flow_confirmation\":\"unavailable\",\"price_preference\":\"positive\",\"time_profile\":\"mixed\",\"weeks_until_trend\":2},\"quality\":{\"classification_eligible\":true,\"constituent_count\":7,\"coverage_ratio\":1.0,\"direction_eligible\":false,\"evidence_eligible\":true,\"history_weeks\":1,\"metric_valid_counts\":{\"above_50dma\":7,\"market_cap\":0,\"return_13w\":7,\"return_4w\":7,\"within_5pct_52w_high\":7},\"missing_required_fields\":[],\"phase_initial_diffusion_eligible\":false,\"phase_overheat_eligible\":true,\"quality_reasons\":[\"Q_HISTORY_BELOW_3\",\"Q_ROLE_PERIPHERAL_BELOW_2\",\"Q_MARKET_CAP_COVERAGE_BELOW_075\"],\"role_valid_counts\":{\"beneficiary\":2,\"core\":4,\"peripheral\":1},\"valid_constituent_count\":7}},\"mechanical_priority\":\"watch\",\"mechanical_rank\":2,\"monitoring_status\":\"excluded\",\"price_confirmation\":{\"breadth_gate\":{\"missing_fields\":[],\"observed_values\":{\"advance_ratio_4w\":0.7142857142857143,\"pct_above_50dma\":1.0},\"reason_code\":\"PASS\",\"required_operator\":\">= for both\",\"required_values\":{\"advance_ratio_4w\":0.6,\"pct_above_50dma\":0.5},\"status\":\"pass\"},\"breadth_pass\":true,\"data_available\":true,\"missing_fields\":[],\"quality_gate\":{\"missing_fields\":[],\"observed_value\":true,\"reason_code\":\"PASS\",\"required_operator\":\"is\",\"required_value\":true,\"status\":\"pass\"},\"quality_pass\":true,\"relative_gate\":{\"difference\":-0.02193927783400049,\"missing_fields\":[],\"observed_value\":0.028060722165999512,\"reason_code\":\"RELATIVE_BELOW_THRESHOLD\",\"required_operator\":\">=\",\"required_value\":0.05,\"status\":\"fail\"},\"relative_threshold_pass\":false,\"status\":\"fail\"},\"selection_eligible\":false,\"selection_gate_reasons\":[\"HARD_EXCLUSION\",\"RELATIVE_RELATIVE_BELOW_THRESHOLD\",\"FUNDAMENTAL_FUNDAMENTAL_CONFIRMATION_MISSING\",\"CANDIDATE_BUCKET_AVOID_NOW\"],\"selection_gate_status\":\"fail\",\"theme_id\":\"cybersecurity\"},{\"candidate_bucket\":\"avoid_now\",\"fundamental_confirmation\":null,\"fundamental_gate\":{\"missing_fields\":[\"fundamental_confirmation\"],\"reason_code\":\"FUNDAMENTAL_CONFIRMATION_MISSING\",\"status\":\"not_evaluable\"},\"hard_exclusion\":true,\"hard_exclusion_reason\":\"avoid_now\",\"machine_reason_components\":{\"condition_flags\":{\"broad_concentration_pass\":false,\"contrary_evidence\":[],\"direction_improving\":null,\"direction_outflow_signal\":null,\"direction_worsening\":null,\"matched_conditions\":[],\"overheat_breadth_weak\":null,\"phase_diffusion\":null,\"phase_initial\":null,\"phase_price_overheat\":null,\"unmatched_conditions\":[]},\"decision\":{\"analysis_mode\":\"initial_observation\",\"candidate_bucket\":\"avoid_now\",\"direct_flow_confirmation\":\"unavailable\",\"price_preference\":\"positive\",\"time_profile\":\"strengthening\",\"weeks_until_trend\":2},\"quality\":{\"classification_eligible\":true,\"constituent_count\":8,\"coverage_ratio\":1.0,\"direction_eligible\":false,\"evidence_eligible\":true,\"history_weeks\":1,\"metric_valid_counts\":{\"above_50dma\":8,\"market_cap\":0,\"return_13w\":8,\"return_4w\":8,\"within_5pct_52w_high\":8},\"missing_required_fields\":[],\"phase_initial_diffusion_eligible\":false,\"phase_overheat_eligible\":true,\"quality_reasons\":[\"Q_HISTORY_BELOW_3\",\"Q_ROLE_PERIPHERAL_BELOW_2\",\"Q_MARKET_CAP_COVERAGE_BELOW_075\"],\"role_valid_counts\":{\"beneficiary\":2,\"core\":5,\"peripheral\":1},\"valid_constituent_count\":8}},\"mechanical_priority\":\"watch\",\"mechanical_rank\":3,\"monitoring_status\":\"excluded\",\"price_confirmation\":{\"breadth_gate\":{\"missing_fields\":[],\"observed_values\":{\"advance_ratio_4w\":0.5,\"pct_above_50dma\":0.5},\"reason_code\":\"BREADTH_BELOW_THRESHOLD\",\"required_operator\":\">= for both\",\"required_values\":{\"advance_ratio_4w\":0.6,\"pct_above_50dma\":0.5},\"status\":\"fail\"},\"breadth_pass\":false,\"data_available\":true,\"missing_fields\":[],\"quality_gate\":{\"missing_fields\":[],\"observed_value\":true,\"reason_code\":\"PASS\",\"required_operator\":\"is\",\"required_value\":true,\"status\":\"pass\"},\"quality_pass\":true,\"relative_gate\":{\"difference\":-0.049795437525676486,\"missing_fields\":[],\"observed_value\":0.00020456247432351637,\"reason_code\":\"RELATIVE_BELOW_THRESHOLD\",\"required_operator\":\">=\",\"required_value\":0.05,\"status\":\"fail\"},\"relative_threshold_pass\":false,\"status\":\"fail\"},\"selection_eligible\":false,\"selection_gate_reasons\":[\"HARD_EXCLUSION\",\"RELATIVE_RELATIVE_BELOW_THRESHOLD\",\"BREADTH_BREADTH_BELOW_THRESHOLD\",\"FUNDAMENTAL_FUNDAMENTAL_CONFIRMATION_MISSING\",\"CANDIDATE_BUCKET_AVOID_NOW\"],\"selection_gate_status\":\"fail\",\"theme_id\":\"defense\"},{\"candidate_bucket\":\"avoid_now\",\"fundamental_confirmation\":null,\"fundamental_gate\":{\"missing_fields\":[\"fundamental_confirmation\"],\"reason_code\":\"FUNDAMENTAL_CONFIRMATION_MISSING\",\"statu",
  "fragment_byte_length": 8192,
  "fragment_sha256": "8cba88471105561e66c4d2f9088940b5f874c8026bddc24e3e17c88ea132109b"
}
