{
  "consumer_contract_version": "4.0",
  "chunk_version": "1.0",
  "generation_id": "6c2260ba8b98d8fccd20d14e35fb616ff40e1d7bc1d7af296cf514e962deffa0",
  "package": "companies",
  "part": 1,
  "part_count": 1,
  "fragment": "{\"analysis_id\":\"3c07b5c0e7a3ed0c8aabcce577be51f4906abff8755f2e1f16305b55a043dbdb\",\"artifact_type\":\"COMPANY_CANDIDATE_FACTS\",\"companies\":[{\"candidate_origin\":\"exploratory_company_candidate\",\"company_candidate_id\":\"oil_gas_exploration:COP\",\"company_name\":null,\"company_role\":\"breadth_check\",\"constituent_centrality\":null,\"duplicate_theme_exposure\":[],\"earnings_exposure\":{\"status\":\"not_available\",\"value\":null},\"exclusion_reason\":null,\"financial_quality\":{\"status\":\"not_available\",\"value\":null},\"formal_dynamic_industry_present\":false,\"handoff_scope\":\"exploratory_only\",\"inclusion_reason\":\"石油・ガス開発の別企業にも及ぶ上昇の広がりを確認するためです。\",\"liquidity\":{\"status\":\"not_available\",\"value\":null},\"market_cap\":{\"status\":\"not_available\",\"value\":null},\"missingness\":[\"revenue_exposure\",\"earnings_exposure\",\"operating_leverage\",\"financial_quality\",\"market_cap\"],\"operating_leverage\":{\"status\":\"not_available\",\"value\":null},\"price_confirmation\":{\"breadth_gate\":{\"missing_fields\":[\"advance_ratio_4w\",\"pct_above_50dma\"],\"observed_values\":{\"advance_ratio_4w\":null,\"pct_above_50dma\":null},\"reason_code\":\"BREADTH_DATA_MISSING\",\"required_operator\":\">= for both\",\"required_values\":{\"advance_ratio_4w\":0.6,\"pct_above_50dma\":0.5},\"status\":\"not_evaluable\"},\"breadth_pass\":false,\"data_available\":false,\"missing_fields\":[\"advance_ratio_4w\",\"classification_eligible\",\"equal_weight_rel_spy_4w\",\"pct_above_50dma\"],\"quality_gate\":{\"missing_fields\":[\"classification_eligible\"],\"observed_value\":null,\"reason_code\":\"QUALITY_STATUS_MISSING\",\"required_operator\":\"is\",\"required_value\":true,\"status\":\"not_evaluable\"},\"quality_pass\":false,\"relative_gate\":{\"difference\":null,\"missing_fields\":[\"equal_weight_rel_spy_4w\"],\"observed_value\":null,\"reason_code\":\"MISSING_REQUIRED_VALUE\",\"required_operator\":\">=\",\"required_value\":0.05,\"status\":\"not_evaluable\"},\"relative_threshold_pass\":false,\"status\":\"not_evaluable\"},\"ranking_eligible\":false,\"revenue_exposure\":{\"status\":\"not_available\",\"value\":null},\"theme_id\":\"oil_gas_exploration\",\"theme_membership\":\"outside_fixed_theme_set\",\"ticker\":\"COP\"},{\"candidate_origin\":\"exploratory_company_candidate\",\"company_candidate_id\":\"oil_gas_exploration:OXY\",\"company_name\":null,\"company_role\":\"representative\",\"constituent_centrality\":null,\"duplicate_theme_exposure\":[],\"earnings_exposure\":{\"status\":\"not_available\",\"value\":null},\"exclusion_reason\":null,\"financial_quality\":{\"status\":\"not_available\",\"value\":null},\"formal_dynamic_industry_present\":false,\"handoff_scope\":\"exploratory_only\",\"inclusion_reason\":\"石油・ガス開発の代表企業として中心的な強さを確認するためです。\",\"liquidity\":{\"status\":\"not_available\",\"value\":null},\"market_cap\":{\"status\":\"not_available\",\"value\":null},\"missingness\":[\"revenue_exposure\",\"earnings_exposure\",\"operating_leverage\",\"financial_quality\",\"market_cap\"],\"operating_leverage\":{\"status\":\"not_available\",\"value\":null},\"price_confirmation\":{\"breadth_gate\":{\"missing_fields\":[\"advance_ratio_4w\",\"pct_above_50dma\"],\"observed_values\":{\"advance_ratio_4w\":null,\"pct_above_50dma\":null},\"reason_code\":\"BREADTH_DATA_MISSING\",\"required_operator\":\">= for both\",\"required_values\":{\"advance_ratio_4w\":0.6,\"pct_above_50dma\":0.5},\"status\":\"not_evaluable\"},\"breadth_pass\":false,\"data_available\":false,\"missing_fields\":[\"advance_ratio_4w\",\"classification_eligible\",\"equal_weight_rel_spy_4w\",\"pct_above_50dma\"],\"quality_gate\":{\"missing_fields\":[\"classification_eligible\"],\"observed_value\":null,\"reason_code\":\"QUALITY_STATUS_MISSING\",\"required_operator\":\"is\",\"required_value\":true,\"status\":\"not_evaluable\"},\"quality_pass\":false,\"relative_gate\":{\"difference\":null,\"missing_fields\":[\"equal_weight_rel_spy_4w\"],\"observed_value\":null,\"reason_code\":\"MISSING_REQUIRED_VALUE\",\"required_operator\":\">=\",\"required_value\":0.05,\"status\":\"not_evaluable\"},\"relative_threshold_pass\":false,\"status\":\"not_evaluable\"},\"ranking_eligible\":false,\"revenue_exposure\":{\"status\":\"not_available\",\"value\":null},\"theme_id\":\"oil_gas_exploration\",\"theme_membership\":\"outside_fixed_theme_set\",\"ticker\":\"OXY\"}],\"company_candidate_ids\":[\"oil_gas_exploration:COP\",\"oil_gas_exploration:OXY\"],\"company_candidate_set_identity\":\"e43a017d975e730cfdf837be4f59bac3d25c26f3bf9ff0e5568566977a479144\",\"consumer_contract_version\":\"4.0\",\"data_date\":\"2026-07-31\",\"data_quality\":{\"coverage\":{},\"global_quality\":{\"coverage_ratio\":0.9929078014184397,\"critical_missing\":[],\"missing_tickers\":[\"VUL\"],\"requested_ticker_count\":141,\"usable_ticker_count\":140,\"warnings\":[\"OVERLAP:CEG\",\"OVERLAP:PLTR\",\"OVERLAP:VST\"]},\"warnings\":[]},\"disclosure_stage\":\"blind\",\"generated_at\":\"2026-08-03T11:55:38.864564Z\",\"generation_id\":\"6c2260ba8b98d8fccd20d14e35fb616ff40e1d7bc1d7af296cf514e962deffa0\",\"source_cutoff\":\"2026-07-31\",\"source_sha256\":\"a3f410670be797e1f45928e50de23cc216c1d0717e3ffb58f6d7ed19e3b28c8b\",\"theme_ids\":[\"ai_semis\",\"ai_software_data\",\"cybersecurity\",\"dc_power_infra\",\"defense\",\"networking_optical\",\"nuclear_uranium\",\"semi_equipment\"],\"theme_set_identity\":\"93386485adbf9ae6826caf36e0ff7574a1e04c00cf1a8c075d760c848525667f\"}",
  "fragment_byte_length": 5057,
  "fragment_sha256": "9d3841489bc05ae4c1fe35bdf9a178f32e551ed3eda9c3bbb2f7c0f832e6609e"
}
