{
  "consumer_contract_version": "4.0",
  "chunk_version": "1.0",
  "generation_id": "6fa376320c04fc2d4cc4191a7ffeb500f434c4cf949dd3f9297a7ca6941f59a6",
  "package": "blind",
  "part": 3,
  "part_count": 5,
  "fragment": "e_3w\":null,\"advance_breadth_trend_3w\":\"insufficient\",\"advance_count_change_1w\":null,\"advance_count_change_3w\":null,\"rel_spy_4w_change_1w\":null,\"rel_spy_4w_slope_3w\":null,\"rel_spy_4w_slope_4w\":null,\"rel_spy_4w_trend_3w\":\"insufficient\",\"rel_spy_4w_trend_4w\":\"insufficient\",\"volume_ratio_change_1w\":null}},{\"classifications_observed\":{\"direction\":\"unclassifiable\",\"evidence\":{\"direct_flow_data_available\":false,\"direction\":\"outflow\",\"level\":\"relative_preference_suggested\",\"matched_conditions\":[\"EV_REL_ALL_NONPOSITIVE\",\"EV_BREADTH_WEAK\",\"EV_DIRECTION_OUTFLOW\"],\"positioning_hypothesis\":\"not_supported\"},\"phase\":\"unclassifiable\"},\"constituents\":[{\"dollar_volume_20d\":673272988.6440506,\"market_cap\":null,\"overlap_theme_count\":2,\"positive_contribution_ratio\":0.6779150408850685,\"rel_spy_4w\":0.10249018171728097,\"return_4w\":0.11404390245395768,\"role\":\"beneficiary\",\"ticker\":\"CEG\",\"valid\":true},{\"dollar_volume_20d\":912560187.9665635,\"market_cap\":null,\"overlap_theme_count\":1,\"positive_contribution_ratio\":0.32208495911493146,\"rel_spy_4w\":0.04869422272294566,\"return_4w\":0.060247943459622366,\"role\":\"core\",\"ticker\":\"ETN\",\"valid\":true},{\"dollar_volume_20d\":2965862700.0070677,\"market_cap\":null,\"overlap_theme_count\":1,\"positive_contribution_ratio\":0.0,\"rel_spy_4w\":-0.1343088989729777,\"return_4w\":-0.122755178236301,\"role\":\"core\",\"ticker\":\"GEV\",\"valid\":true},{\"dollar_volume_20d\":343377292.4384705,\"market_cap\":null,\"overlap_theme_count\":1,\"positive_contribution_ratio\":0.0,\"rel_spy_4w\":-0.1664656079523127,\"return_4w\":-0.15491188721563598,\"role\":\"peripheral\",\"ticker\":\"MOD\",\"valid\":true},{\"dollar_volume_20d\":288372768.2493973,\"market_cap\":null,\"overlap_theme_count\":1,\"positive_contribution_ratio\":0.0,\"rel_spy_4w\":-0.014772465807847746,\"return_4w\":-0.0032187450711710364,\"role\":\"peripheral\",\"ticker\":\"NRG\",\"valid\":true},{\"dollar_volume_20d\":706244892.7329438,\"market_cap\":null,\"overlap_theme_count\":1,\"positive_contribution_ratio\":0.0,\"rel_spy_4w\":-0.016753367006569375,\"return_4w\":-0.005199646269892666,\"role\":\"beneficiary\",\"ticker\":\"PWR\",\"valid\":true},{\"dollar_volume_20d\":1586057902.5970244,\"market_cap\":null,\"overlap_theme_count\":1,\"positive_contribution_ratio\":0.0,\"rel_spy_4w\":-0.18052187361844163,\"return_4w\":-0.16896815288176492,\"role\":\"core\",\"ticker\":\"VRT\",\"valid\":true},{\"dollar_volume_20d\":608801591.8882599,\"market_cap\":null,\"overlap_theme_count\":2,\"positive_contribution_ratio\":0.0,\"rel_spy_4w\":-0.02631701555617394,\"return_4w\":-0.01476329481949723,\"role\":\"beneficiary\",\"ticker\":\"VST\",\"valid\":true}],\"description\":null,\"display_name\":\"データセンター電力・インフラ\",\"metrics\":{\"above_50dma_count\":3,\"advance_count_4w\":2,\"advance_ratio_4w\":0.25,\"contribution_hhi\":0.5633075235462712,\"effective_contributor_count\":1.7752292632353914,\"equal_weight_led\":null,\"equal_weight_rel_spy_13w\":-0.17080942068480987,\"equal_weight_rel_spy_1w\":-0.04934305997780834,\"equal_weight_rel_spy_4w\":-0.04849435305926206,\"equal_weight_rel_spy_previous_3w\":-0.021585818865323667,\"equal_weight_rel_spy_previous_9w\":-0.10121060613195693,\"equal_weight_return_13w\":-0.12269189460172615,\"equal_weight_return_1w\":-0.030001731600025103,\"equal_weight_return_4w\":-0.03694063232258535,\"liquidity_weight_rel_spy_4w\":-0.08169828857910058,\"market_cap_led\":null,\"market_cap_weight_rel_spy_4w\":null,\"median_rel_spy_4w\":-0.021535191281371657,\"pct_above_50dma\":0.375,\"pct_within_5pct_52w_high\":0.125,\"single_name_concentrated\":true,\"top1_contribution_ratio\":0.6779150408850685,\"top3_contribution_ratio\":1.0,\"unique_constituent_count\":8,\"volume_ratio_20d_60d\":0.8842595305380841,\"weighting_divergence_4w\":null,\"winsorized_equal_weight_rel_spy_4w\":-0.053461814725287854},\"quality\":{\"classification_eligible\":true,\"constituent_count\":8,\"coverage_ratio\":1.0,\"direction_eligible\":false,\"evidence_eligible\":true,\"history_weeks\":1,\"metric_valid_counts\":{\"above_50dma\":8,\"market_cap\":0,\"return_13w\":8,\"return_4w\":8,\"within_5pct_52w_high\":8},\"missing_required_fields\":[],\"phase_initial_diffusion_eligible\":false,\"phase_overheat_eligible\":true,\"quality_reasons\":[\"Q_HISTORY_BELOW_3\",\"Q_MARKET_CAP_COVERAGE_BELOW_075\"],\"role_valid_counts\":{\"beneficiary\":3,\"core\":3,\"peripheral\":2},\"valid_constituent_count\":8},\"structural_context\":{\"as_of\":\"2026-07-15\",\"source_category\":[\"repository_theme_master\"],\"status\":\"not_assessed\",\"summary\":\"固定テーマとしての構成管理はありますが、長期材料を裏付ける根拠は未評価です。\",\"version\":\"1.0\"},\"theme_id\":\"dc_power_infra\",\"trends\":{\"above_50dma_breadth_trend_3w\":\"insufficient\",\"above_50dma_count_change_1w\":null,\"above_50dma_count_change_3w\":null,\"advance_breadth_trend_3w\":\"insufficient\",\"advance_count_change_1w\":null,\"advance_count_change_3w\":null,\"rel_spy_4w_change_1w\":null,\"rel_spy_4w_slope_3w\":null,\"rel_spy_4w_slope_4w\":null,\"rel_spy_4w_trend_3w\":\"insufficient\",\"rel_spy_4w_trend_4w\":\"insufficient\",\"volume_ratio_change_1w\":null}},{\"classifications_observed\":{\"direction\":\"unclassifiable\",\"evidence\":{\"direct_flow_data_available\":false,\"direction\":\"down\",\"level\":\"price_only\",\"matched_conditions\":[],\"positioning_hypothesis\":\"not_supported\"},\"phase\":\"unclassifiable\"},\"constituents\":[{\"dollar_volume_20d\":211625083.37144166,\"market_cap\":null,\"overlap_theme_count\":1,\"positive_contribution_ratio\":0.0,\"rel_spy_4w\":-0.19618882592751874,\"return_4w\":-0.18463510519084203,\"role\":\"beneficiary\",\"ticker\":\"AVAV\",\"valid\":true},{\"dollar_volume_20d\":427870078.45510405,\"market_cap\":null,\"overlap_theme_count\":1,\"positive_contribution_ratio\":0.11821256952931111,\"rel_spy_4w\":0.019714663930548548,\"return_4w\":0.03126838466722526,\"role\":\"core\",\"ticker\":\"GD\",\"valid\":true},{\"dollar_volume_20d\":159194550.37784654,\"market_cap\":null,\"overlap_theme_count\":1,\"positive_contribution_ratio\":0.0,\"rel_spy_4w\":-0.1426286521444896,\"return_4w\":-0.1310749314078129,\"role\":\"peripheral\",\"ticker\":\"KTOS\",\"valid\":true},{\"dollar_volume_20d\":388896403.133667,\"market_cap\":null,\"overlap_theme_count\":1,\"positive_contribution_ratio\":0.0,\"rel_spy_4w\":-0.08362317153747645,\"return_4w\":-0.07206945080079974,\"role\":\"core\",\"ticker\":\"LHX\",\"valid\":true},{\"dollar_volume_20d\":634083749.0390441,\"market_cap\":null,\"overlap_theme_count\":1,\"positive_contribution_ratio\":0.3970399697186828,\"rel_spy_4w\":0.06621554375449179,\"return_4w\":0.0777692644911685,\"role\":\"core\",\"ticker\":\"LMT\",\"valid\":true},{\"dollar_volume_20d\":477329956.02749026,\"market_cap\":null,\"overlap_theme_count\":1,\"positive_contribution_ratio\":0.0,\"rel_spy_4w\":-0.0013718192760843184,\"return_4w\":0.01018190146059239,\"role\":\"core\",\"ticker\":\"NOC\",\"valid\":true},{\"dollar_volume_20d\":4215230559.6776657,\"market_cap\":null,\"overlap_theme_count\":2,\"positive_contribution_ratio\":0.0,\"rel_spy_4w\":-0.034252909589854275,\"return_4w\":-0.022699188853177565,\"role\":\"beneficiary\",\"ticker\":\"PLTR\",\"valid\":true},{\"dollar_volume_20d\":995606174.71138,\"market_cap\":null,\"overlap_theme_count\":1,\"positive_contribution_ratio\":0.4847474607520061,\"rel_spy_4w\":0.08084278446838922,\"return_4w\":0.09239650520506593,\"role\":\"core\",\"ticker\":\"RTX\",\"valid\":true}],\"description\":null,\"display_name\":\"防衛\",\"metrics\":{\"above_50dma_count\":4,\"advance_count_4w\":4,\"advance_ratio_4w\":0.5,\"contribution_hhi\":0.40659504985445244,\"effective_contributor_count\":2.4594495195107933,\"equal_weight_led\":null,\"equal_weight_rel_spy_13w\":-0.06035049677020787,\"equal_weight_rel_spy_1w\":-0.03437285932532591,\"equal_weight_rel_spy_4w\":-0.03641154829024923,\"equal_weight_rel_spy_previous_3w\":0.015035856254975333,\"equal_weight_rel_spy_previous_9w\":-0.04702501689177821,\"equal_weight_return_13w\":-0.012232970687124145,\"equal_weight_return_1w\":-0.01503153094754267,\"equal_weight_return_4w\":-0.02485782755357252,\"liquidity_weight_rel_spy_4w\":-0.014763911555220546,\"market_cap_led\":null,\"market_cap_weight_rel_spy_4w\":null,\"median_rel_spy_4w\":-0.017812364432969297,\"pct_above_50dma\":0.5,\"pct_within_5pct_52w_high\":0.25,\"single_name_concentrated\":false,\"top1_contribution_ratio\":0.4847474607520061,\"top3_contribution_ratio\":1.0,\"unique_constituent_count\":8,\"volume_ratio_20d_60d\":0.8824911338016064,\"weighting_divergence_4w\":null,\"winsorized_equal_weight_rel_spy_4w\":-0.031544931656607766},\"quality\":{\"classification_eligible\":true,\"constituent_count\":8,\"coverage_ratio\":1.0,\"dire",
  "fragment_byte_length": 8192,
  "fragment_sha256": "ac5675d1ac5b3d0ffd5dbb0859212499fe33108fe8de0b411f056c33cf7ac3ca"
}
