{
  "consumer_contract_version": "4.0",
  "chunk_version": "1.0",
  "generation_id": "6df6bad82c5e2d0b0cd0c7cf14d597f10416fff5cc750893dd1f3a08413a4848",
  "package": "blind-handoff",
  "part": 1,
  "part_count": 4,
  "fragment": "{\"analysis_id\":\"b339f8facbff1d3e1914630792af71600db4bc0fc3c86a97398bbc4f46e92b62\",\"artifact_type\":\"BLIND_COMPARISON_HANDOFF\",\"beneficiary_characteristics\":[],\"companies\":[{\"candidate_origin\":\"exploratory_company_candidate\",\"company_candidate_id\":\"oil_gas_exploration:COP\",\"company_name\":null,\"company_role\":\"breadth_check\",\"constituent_centrality\":null,\"duplicate_theme_exposure\":[],\"earnings_exposure\":{\"status\":\"not_available\",\"value\":null},\"exclusion_reason\":null,\"financial_quality\":{\"status\":\"not_available\",\"value\":null},\"formal_dynamic_industry_present\":false,\"handoff_scope\":\"exploratory_only\",\"inclusion_reason\":\"石油・ガス開発の別企業にも及ぶ上昇の広がりを確認するためです。\",\"liquidity\":{\"status\":\"not_available\",\"value\":null},\"market_cap\":{\"status\":\"not_available\",\"value\":null},\"missingness\":[\"revenue_exposure\",\"earnings_exposure\",\"operating_leverage\",\"financial_quality\",\"market_cap\"],\"operating_leverage\":{\"status\":\"not_available\",\"value\":null},\"price_confirmation\":{\"breadth_gate\":{\"missing_fields\":[\"advance_ratio_4w\",\"pct_above_50dma\"],\"observed_values\":{\"advance_ratio_4w\":null,\"pct_above_50dma\":null},\"reason_code\":\"BREADTH_DATA_MISSING\",\"required_operator\":\">= for both\",\"required_values\":{\"advance_ratio_4w\":0.6,\"pct_above_50dma\":0.5},\"status\":\"not_evaluable\"},\"breadth_pass\":false,\"data_available\":false,\"missing_fields\":[\"advance_ratio_4w\",\"classification_eligible\",\"equal_weight_rel_spy_4w\",\"pct_above_50dma\"],\"quality_gate\":{\"missing_fields\":[\"classification_eligible\"],\"observed_value\":null,\"reason_code\":\"QUALITY_STATUS_MISSING\",\"required_operator\":\"is\",\"required_value\":true,\"status\":\"not_evaluable\"},\"quality_pass\":false,\"relative_gate\":{\"difference\":null,\"missing_fields\":[\"equal_weight_rel_spy_4w\"],\"observed_value\":null,\"reason_code\":\"MISSING_REQUIRED_VALUE\",\"required_operator\":\">=\",\"required_value\":0.05,\"status\":\"not_evaluable\"},\"relative_threshold_pass\":false,\"status\":\"not_evaluable\"},\"ranking_eligible\":false,\"revenue_exposure\":{\"status\":\"not_available\",\"value\":null},\"theme_id\":\"oil_gas_exploration\",\"theme_membership\":\"outside_fixed_theme_set\",\"ticker\":\"COP\"},{\"candidate_origin\":\"exploratory_company_candidate\",\"company_candidate_id\":\"oil_gas_exploration:OXY\",\"company_name\":null,\"company_role\":\"representative\",\"constituent_centrality\":null,\"duplicate_theme_exposure\":[],\"earnings_exposure\":{\"status\":\"not_available\",\"value\":null},\"exclusion_reason\":null,\"financial_quality\":{\"status\":\"not_available\",\"value\":null},\"formal_dynamic_industry_present\":false,\"handoff_scope\":\"exploratory_only\",\"inclusion_reason\":\"石油・ガス開発の代表企業として中心的な強さを確認するためです。\",\"liquidity\":{\"status\":\"not_available\",\"value\":null},\"market_cap\":{\"status\":\"not_available\",\"value\":null},\"missingness\":[\"revenue_exposure\",\"earnings_exposure\",\"operating_leverage\",\"financial_quality\",\"market_cap\"],\"operating_leverage\":{\"status\":\"not_available\",\"value\":null},\"price_confirmation\":{\"breadth_gate\":{\"missing_fields\":[\"advance_ratio_4w\",\"pct_above_50dma\"],\"observed_values\":{\"advance_ratio_4w\":null,\"pct_above_50dma\":null},\"reason_code\":\"BREADTH_DATA_MISSING\",\"required_operator\":\">= for both\",\"required_values\":{\"advance_ratio_4w\":0.6,\"pct_above_50dma\":0.5},\"status\":\"not_evaluable\"},\"breadth_pass\":false,\"data_available\":false,\"missing_fields\":[\"advance_ratio_4w\",\"classification_eligible\",\"equal_weight_rel_spy_4w\",\"pct_above_50dma\"],\"quality_gate\":{\"missing_fields\":[\"classification_eligible\"],\"observed_value\":null,\"reason_code\":\"QUALITY_STATUS_MISSING\",\"required_operator\":\"is\",\"required_value\":true,\"status\":\"not_evaluable\"},\"quality_pass\":false,\"relative_gate\":{\"difference\":null,\"missing_fields\":[\"equal_weight_rel_spy_4w\"],\"observed_value\":null,\"reason_code\":\"MISSING_REQUIRED_VALUE\",\"required_operator\":\">=\",\"required_value\":0.05,\"status\":\"not_evaluable\"},\"relative_threshold_pass\":false,\"status\":\"not_evaluable\"},\"ranking_eligible\":false,\"revenue_exposure\":{\"status\":\"not_available\",\"value\":null},\"theme_id\":\"oil_gas_exploration\",\"theme_membership\":\"outside_fixed_theme_set\",\"ticker\":\"OXY\"}],\"company_candidate_ids\":[\"oil_gas_exploration:COP\",\"oil_gas_exploration:OXY\"],\"company_candidate_set_identity\":\"e43a017d975e730cfdf837be4f59bac3d25c26f3bf9ff0e5568566977a479144\",\"consumer_contract_version\":\"4.0\",\"data_date\":\"2026-07-31\",\"disclosure_stage\":\"blind\",\"generated_at\":\"2026-08-03T09:35:58.433388Z\",\"generation_id\":\"6df6bad82c5e2d0b0cd0c7cf14d597f10416fff5cc750893dd1f3a08413a4848\",\"required_company_checks\":[\"revenue exposure\",\"earnings exposure\",\"operating leverage\",\"financial quality\",\"valuation\"],\"source_cutoff\":\"2026-07-31\",\"source_sha256\":\"f447d6b09b93c56466ed0064226dae2a93e1c221941b1473f5bbabc60f07aef7\",\"theme_ids\":[\"ai_semis\",\"ai_software_data\",\"cybersecurity\",\"dc_power_infra\",\"defense\",\"networking_optical\",\"nuclear_uranium\",\"semi_equipment\"],\"theme_set_identity\":\"93386485adbf9ae6826caf36e0ff7574a1e04c00cf1a8c075d760c848525667f\",\"themes\":[{\"constituents\":[{\"dollar_volume_20d\":14274544897.059784,\"market_cap\":null,\"overlap_theme_count\":1,\"positive_contribution_ratio\":0.0,\"rel_spy_4w\":-0.1213783500210831,\"return_4w\":-0.11967536311561855,\"role\":\"core\",\"ticker\":\"AMD\",\"valid\":true},{\"dollar_volume_20d\":1720257941.1386108,\"market_cap\":null,\"overlap_theme_count\":1,\"positive_contribution_ratio\":0.0,\"rel_spy_4w\":-0.2914472558052338,\"return_4w\":-0.28974426889976923,\"role\":\"beneficiary\",\"ticker\":\"ARM\",\"valid\":true},{\"dollar_volume_20d\":7913122574.256134,\"market_cap\":null,\"overlap_theme_count\":1,\"positive_contribution_ratio\":0.7847527737443777,\"rel_spy_4w\":0.05228521539896214,\"return_4w\":0.05398820230442669,\"role\":\"core\",\"ticker\":\"AVGO\",\"valid\":true},{\"dollar_volume_20d\":5074092008.459854,\"market_cap\":null,\"overlap_theme_count\":1,\"positive_contribution_ratio\":0.0,\"rel_spy_4w\":-0.3121007670607213,\"return_4w\":-0.31039778015525676,\"role\":\"core\",\"ticker\":\"MRVL\",\"valid\":true},{\"dollar_volume_20d\":41887467969.88068,\"market_cap\":null,\"overlap_theme_count\":1,\"positive_contribution_ratio\":0.0,\"rel_spy_4w\":-0.20428702515534292,\"return_4w\":-0.20258403824987836,\"role\":\"beneficiary\",\"ticker\":\"MU\",\"valid\":true},{\"dollar_volume_20d\":26043440122.883987,\"market_cap\":null,\"overlap_theme_count\":1,\"positive_contribution_ratio\":0.21524722625562234,\"rel_spy_4w\":0.014341137700101037,\"return_4w\":0.01604412460556559,\"role\":\"core\",\"ticker\":\"NVDA\",\"valid\":true},{\"dollar_volume_20d\":2290869913.37471,\"market_cap\":null,\"overlap_theme_count\":1,\"positive_contribution_ratio\":0.0,\"rel_spy_4w\":-0.19030235972829612,\"return_4w\":-0.18859937282283157,\"role\":\"peripheral\",\"ticker\":\"QCOM\",\"valid\":true},{\"dollar_volume_20d\":6221398316.60141,\"market_cap\":null,\"overlap_theme_count\":1,\"positive_contribution_ratio\":0.0,\"rel_spy_4w\":-0.09170143365056427,\"return_4w\":-0.08999844674509971,\"role\":\"core\",\"ticker\":\"TSM\",\"valid\":true}],\"display_name\":\"AI半導体\",\"metrics\":{\"above_50dma_count\":0,\"advance_count_4w\":2,\"advance_ratio_4w\":0.25,\"contribution_hhi\":0.6621682843102334,\"effective_contributor_count\":1.510190118878434,\"equal_weight_led\":null,\"equal_weight_rel_spy_13w\":0.08280900961810456,\"equal_weight_rel_spy_1w\":-0.06478724742124133,\"equal_weight_rel_spy_4w\":-0.1430738547902723,\"equal_weight_rel_spy_previous_3w\":-0.046320159155833984,\"equal_weight_rel_spy_previous_9w\":0.24317571424909956,\"equal_weight_return_13w\":0.12496327226314452,\"equal_weight_return_1w\":-0.05382540164237083,\"equal_weight_return_4w\":-0.14137086788480774,\"liquidity_weight_rel_spy_4w\":-0.11945832075599012,\"market_cap_led\":null,\"market_cap_weight_rel_spy_4w\":null,\"median_rel_spy_4w\":-0.1558403548746896,\"pct_above_50dma\":0.0,\"pct_within_5pct_52w_high\":0.0,\"single_name_concentrated\":true,\"top1_contribution_ratio\":0.7847527737443777,\"top3_contribution_ratio\":1.0,\"unique_constituent_count\":8,\"volume_ratio_20d_60d\":0.7751484784437489,\"weighting_divergence_4w\":null,\"winsorized_equal_weight_rel_spy_4w\":-0.145235175595694},\"quality\":{\"classification_eligible\":true,\"constituent_count\":8,\"coverage_ratio\":1.0,\"direction_eligible\":false,\"evidence_eligible\":true,\"history_weeks\":1,\"metric_valid_counts\":{\"above_50dma\":8,\"market_cap\":0,\"return_13w\":8,\"return_4w\":8,\"within_5pct_52w_high\":8},\"missing_required_fields",
  "fragment_byte_length": 8192,
  "fragment_sha256": "4cba415370e1bd4e0cf5a730174da7004fc5e737bf4ccbe59fde6e162a341dc5"
}
