{
  "consumer_contract_version": "4.0",
  "chunk_version": "1.0",
  "generation_id": "36c2239acd07a38c378706b5f81faa2904e3cf81d42fd36859c4c27ba328d869",
  "package": "blind",
  "part": 1,
  "part_count": 5,
  "fragment": "{\"analysis_id\":\"3c4bc2da1e97a0507e0e94304780373c55b3541611e103ff45b3eab6ae506a7c\",\"artifact_type\":\"BLIND_THEME_PROJECTION\",\"company_candidate_ids\":[\"oil_gas_exploration:COP\",\"oil_gas_exploration:OXY\"],\"company_candidate_set_identity\":\"e43a017d975e730cfdf837be4f59bac3d25c26f3bf9ff0e5568566977a479144\",\"consumer_contract_version\":\"4.0\",\"data_date\":\"2026-07-31\",\"data_quality\":{\"coverage\":{},\"global_quality\":{\"coverage_ratio\":0.9929078014184397,\"critical_missing\":[],\"missing_tickers\":[\"VUL\"],\"requested_ticker_count\":141,\"usable_ticker_count\":140,\"warnings\":[\"OVERLAP:CEG\",\"OVERLAP:PLTR\",\"OVERLAP:VST\"]},\"warnings\":[]},\"disclosure_stage\":\"blind\",\"dynamic_industries\":[],\"generated_at\":\"2026-08-02T21:48:06.755021Z\",\"generation_id\":\"36c2239acd07a38c378706b5f81faa2904e3cf81d42fd36859c4c27ba328d869\",\"market_context\":{\"market_regime\":{\"candidate_flags\":{\"broad_risk_on\":{\"contrary_evidence\":[],\"eligible\":true,\"full_match\":false,\"matched_conditions\":[\"R_BROAD_SPY_POS\",\"R_BROAD_RSP_NONNEG\"],\"unmatched_conditions\":[\"R_BROAD_IWM_NONNEG\",\"R_BROAD_SECTORS_7_OF_11\"]},\"cyclical_recovery_expectation\":{\"contrary_evidence\":[],\"eligible\":true,\"full_match\":false,\"matched_conditions\":[\"R_CYCLE_CREDIT_NONNEG\"],\"unmatched_conditions\":[\"R_CYCLE_IWM2\",\"R_CYCLE_BASKET2\"]},\"defensive_shift\":{\"contrary_evidence\":[],\"eligible\":true,\"full_match\":false,\"matched_conditions\":[\"R_DEF_CYCLICAL_NONPOS\"],\"unmatched_conditions\":[\"R_DEF_REL2\",\"R_DEF_VIX_POS\"]},\"large_growth_concentration\":{\"contrary_evidence\":[],\"eligible\":true,\"full_match\":false,\"matched_conditions\":[\"R_LG_SPY_POS\",\"R_LG_IWM_NEG\",\"R_LG_SECTORS_5\"],\"unmatched_conditions\":[\"R_LG_QQQ_POS\",\"R_LG_RSP_NEG2\"]},\"liquidity_contraction\":{\"contrary_evidence\":[],\"eligible\":true,\"full_match\":false,\"matched_conditions\":[],\"unmatched_conditions\":[\"R_LIQ_SPY_NEG\",\"R_LIQ_CREDIT_NEG1\",\"R_LIQ_VIX3\",\"R_LIQ_UUP_POS\"]},\"real_asset_leadership\":{\"contrary_evidence\":[],\"eligible\":true,\"full_match\":true,\"matched_conditions\":[\"R_REAL_DBC2\",\"R_REAL_GLD_OR_XLE_NONNEG\"],\"unmatched_conditions\":[]}},\"classification\":{\"confidence\":\"medium\",\"contrary_evidence\":[],\"matched_conditions\":[\"R_REAL_DBC2\",\"R_REAL_GLD_OR_XLE_NONNEG\"],\"primary_regime\":\"real_asset_leadership\",\"secondary_regimes\":[]},\"inputs\":{\"cyclical_basket_rel_spy_4w\":-0.0037697655938687125,\"dbc_rel_spy_4w\":0.11171855991745527,\"dbc_rel_spy_4w_trend_3w\":\"improving\",\"defensive_basket_rel_spy_4w\":0.008461639814423346,\"gld_rel_spy_4w\":0.0008334470554773876,\"hyg_minus_lqd_4w\":0.018994172229579553,\"iwm_minus_spy_4w\":-0.02883112708485469,\"iwm_minus_spy_4w_trend_3w\":\"worsening\",\"qqq_rel_spy_4w\":-0.052973714530697213,\"rsp_minus_spy_4w\":0.00579427572173552,\"rsp_minus_spy_4w_trend_3w\":\"worsening\",\"sector_advance_ratio_4w\":0.45454545454545453,\"spy_r_4w\":0.0017029869054645541,\"uup_r_4w\":-0.01123200061056584,\"vix_change_4w\":-0.6000003814697266,\"xle_rel_spy_4w\":0.1259243126306102}},\"style_analysis\":{}},\"source_cutoff\":\"2026-07-31\",\"source_refs\":[\"output/generations/36c2239acd07a38c378706b5f81faa2904e3cf81d42fd36859c4c27ba328d869/archive.json\"],\"source_sha256\":\"aabee7e8c8b891bbf560c631d91b601c7dd482e70e1ca40cf11c35eaf4a9e2d2\",\"theme_ids\":[\"ai_semis\",\"ai_software_data\",\"cybersecurity\",\"dc_power_infra\",\"defense\",\"networking_optical\",\"nuclear_uranium\",\"semi_equipment\"],\"theme_set_identity\":\"93386485adbf9ae6826caf36e0ff7574a1e04c00cf1a8c075d760c848525667f\",\"themes\":[{\"classifications_observed\":{\"direction\":\"unclassifiable\",\"evidence\":{\"direct_flow_data_available\":false,\"direction\":\"outflow\",\"level\":\"relative_preference_suggested\",\"matched_conditions\":[\"EV_DIRECTION_OUTFLOW\"],\"positioning_hypothesis\":\"not_supported\"},\"phase\":\"unclassifiable\"},\"constituents\":[{\"dollar_volume_20d\":14274544897.059784,\"market_cap\":null,\"overlap_theme_count\":1,\"positive_contribution_ratio\":0.0,\"rel_spy_4w\":-0.1213783500210831,\"return_4w\":-0.11967536311561855,\"role\":\"core\",\"ticker\":\"AMD\",\"valid\":true},{\"dollar_volume_20d\":1720257941.1386108,\"market_cap\":null,\"overlap_theme_count\":1,\"positive_contribution_ratio\":0.0,\"rel_spy_4w\":-0.2914472558052338,\"return_4w\":-0.28974426889976923,\"role\":\"beneficiary\",\"ticker\":\"ARM\",\"valid\":true},{\"dollar_volume_20d\":7913122574.256134,\"market_cap\":null,\"overlap_theme_count\":1,\"positive_contribution_ratio\":0.7847527737443777,\"rel_spy_4w\":0.05228521539896214,\"return_4w\":0.05398820230442669,\"role\":\"core\",\"ticker\":\"AVGO\",\"valid\":true},{\"dollar_volume_20d\":5074092008.459854,\"market_cap\":null,\"overlap_theme_count\":1,\"positive_contribution_ratio\":0.0,\"rel_spy_4w\":-0.3121007670607213,\"return_4w\":-0.31039778015525676,\"role\":\"core\",\"ticker\":\"MRVL\",\"valid\":true},{\"dollar_volume_20d\":41887467969.88068,\"market_cap\":null,\"overlap_theme_count\":1,\"positive_contribution_ratio\":0.0,\"rel_spy_4w\":-0.20428702515534292,\"return_4w\":-0.20258403824987836,\"role\":\"beneficiary\",\"ticker\":\"MU\",\"valid\":true},{\"dollar_volume_20d\":26043440122.883987,\"market_cap\":null,\"overlap_theme_count\":1,\"positive_contribution_ratio\":0.21524722625562234,\"rel_spy_4w\":0.014341137700101037,\"return_4w\":0.01604412460556559,\"role\":\"core\",\"ticker\":\"NVDA\",\"valid\":true},{\"dollar_volume_20d\":2290869913.37471,\"market_cap\":null,\"overlap_theme_count\":1,\"positive_contribution_ratio\":0.0,\"rel_spy_4w\":-0.19030235972829612,\"return_4w\":-0.18859937282283157,\"role\":\"peripheral\",\"ticker\":\"QCOM\",\"valid\":true},{\"dollar_volume_20d\":6221398316.60141,\"market_cap\":null,\"overlap_theme_count\":1,\"positive_contribution_ratio\":0.0,\"rel_spy_4w\":-0.09170143365056427,\"return_4w\":-0.08999844674509971,\"role\":\"core\",\"ticker\":\"TSM\",\"valid\":true}],\"description\":null,\"display_name\":\"AI半導体\",\"metrics\":{\"above_50dma_count\":0,\"advance_count_4w\":2,\"advance_ratio_4w\":0.25,\"contribution_hhi\":0.6621682843102334,\"effective_contributor_count\":1.510190118878434,\"equal_weight_led\":null,\"equal_weight_rel_spy_13w\":0.08280900961810456,\"equal_weight_rel_spy_1w\":-0.06478724742124133,\"equal_weight_rel_spy_4w\":-0.1430738547902723,\"equal_weight_rel_spy_previous_3w\":-0.046320159155833984,\"equal_weight_rel_spy_previous_9w\":0.24317571424909956,\"equal_weight_return_13w\":0.12496327226314452,\"equal_weight_return_1w\":-0.05382540164237083,\"equal_weight_return_4w\":-0.14137086788480774,\"liquidity_weight_rel_spy_4w\":-0.11945832075599012,\"market_cap_led\":null,\"market_cap_weight_rel_spy_4w\":null,\"median_rel_spy_4w\":-0.1558403548746896,\"pct_above_50dma\":0.0,\"pct_within_5pct_52w_high\":0.0,\"single_name_concentrated\":true,\"top1_contribution_ratio\":0.7847527737443777,\"top3_contribution_ratio\":1.0,\"unique_constituent_count\":8,\"volume_ratio_20d_60d\":0.7751484784437489,\"weighting_divergence_4w\":null,\"winsorized_equal_weight_rel_spy_4w\":-0.145235175595694},\"quality\":{\"classification_eligible\":true,\"constituent_count\":8,\"coverage_ratio\":1.0,\"direction_eligible\":false,\"evidence_eligible\":true,\"history_weeks\":1,\"metric_valid_counts\":{\"above_50dma\":8,\"market_cap\":0,\"return_13w\":8,\"return_4w\":8,\"within_5pct_52w_high\":8},\"missing_required_fields\":[],\"phase_initial_diffusion_eligible\":false,\"phase_overheat_eligible\":true,\"quality_reasons\":[\"Q_HISTORY_BELOW_3\",\"Q_ROLE_PERIPHERAL_BELOW_2\",\"Q_MARKET_CAP_COVERAGE_BELOW_075\"],\"role_valid_counts\":{\"beneficiary\":2,\"core\":5,\"peripheral\":1},\"valid_constituent_count\":8},\"structural_context\":{\"as_of\":\"2026-07-15\",\"source_category\":[\"repository_theme_master\"],\"status\":\"not_assessed\",\"summary\":\"固定テーマとしての構成管理はありますが、長期材料を裏付ける根拠は未評価です。\",\"version\":\"1.0\"},\"theme_id\":\"ai_semis\",\"trends\":{\"above_50dma_breadth_trend_3w\":\"insufficient\",\"above_50dma_count_change_1w\":null,\"above_50dma_count_change_3w\":null,\"advance_breadth_trend_3w\":\"insufficient\",\"advance_count_change_1w\":null,\"advance_count_change_3w\":null,\"rel_spy_4w_change_1w\":null,\"rel_spy_4w_slope_3w\":null,\"rel_spy_4w_slope_4w\":null,\"rel_spy_4w_trend_3w\":\"insufficient\",\"rel_spy_4w_trend_4w\":\"insufficient\",\"volume_ratio_change_1w\":null}},{\"classifications_observed\":{\"direction\":\"unclassifiable\",\"evidence\":{\"direct_flow_data_available\":false,\"direction\":\"inflow\",\"level\":\"relative_preference_suggested\",\"matched_conditions\":[\"EV_REL_POS\",\"EV_ADVANCE_25\"],\"positioning_hypothesis\":\"not_supported\"},\"phase\":\"unclassifiable\"},\"constituents\":[{\"dollar_volume_20d\":46898896.64987564",
  "fragment_byte_length": 8192,
  "fragment_sha256": "8b075877633c21827cb7d0704253866f7fef7762f2ed87673e0e8125c191376b"
}
