{
  "consumer_contract_version": "4.0",
  "chunk_version": "1.0",
  "generation_id": "6df6bad82c5e2d0b0cd0c7cf14d597f10416fff5cc750893dd1f3a08413a4848",
  "package": "blind-handoff",
  "part": 4,
  "part_count": 4,
  "fragment": "al_weight_return_1w\":-0.021726597906438303,\"equal_weight_return_4w\":-0.18545438515201365,\"liquidity_weight_rel_spy_4w\":-0.16992670821014022,\"market_cap_led\":null,\"market_cap_weight_rel_spy_4w\":null,\"median_rel_spy_4w\":-0.20279137928314894,\"pct_above_50dma\":0.14285714285714285,\"pct_within_5pct_52w_high\":0.14285714285714285,\"single_name_concentrated\":true,\"top1_contribution_ratio\":1.0,\"top3_contribution_ratio\":1.0,\"unique_constituent_count\":7,\"volume_ratio_20d_60d\":0.7557912282057714,\"weighting_divergence_4w\":null,\"winsorized_equal_weight_rel_spy_4w\":-0.20954536164984447},\"quality\":{\"classification_eligible\":true,\"constituent_count\":7,\"coverage_ratio\":1.0,\"direction_eligible\":false,\"evidence_eligible\":true,\"history_weeks\":1,\"metric_valid_counts\":{\"above_50dma\":7,\"market_cap\":0,\"return_13w\":7,\"return_4w\":7,\"within_5pct_52w_high\":7},\"missing_required_fields\":[],\"phase_initial_diffusion_eligible\":false,\"phase_overheat_eligible\":true,\"quality_reasons\":[\"Q_HISTORY_BELOW_3\",\"Q_ROLE_PERIPHERAL_BELOW_2\",\"Q_MARKET_CAP_COVERAGE_BELOW_075\"],\"role_valid_counts\":{\"beneficiary\":2,\"core\":4,\"peripheral\":1},\"valid_constituent_count\":7},\"theme_id\":\"networking_optical\"},{\"constituents\":[{\"dollar_volume_20d\":154752534.31991577,\"market_cap\":null,\"overlap_theme_count\":1,\"positive_contribution_ratio\":0.0,\"rel_spy_4w\":-0.11961149959439432,\"return_4w\":-0.11790851268892977,\"role\":\"core\",\"ticker\":\"BWXT\",\"valid\":true},{\"dollar_volume_20d\":349727324.6990967,\"market_cap\":null,\"overlap_theme_count\":1,\"positive_contribution_ratio\":0.0,\"rel_spy_4w\":-0.11475363076244272,\"return_4w\":-0.11305064385697816,\"role\":\"core\",\"ticker\":\"CCJ\",\"valid\":true},{\"dollar_volume_20d\":710842195.8974457,\"market_cap\":null,\"overlap_theme_count\":2,\"positive_contribution_ratio\":0.6381845814035357,\"rel_spy_4w\":0.1092906705998209,\"return_4w\":0.11099365750528545,\"role\":\"beneficiary\",\"ticker\":\"CEG\",\"valid\":true},{\"dollar_volume_20d\":139732814.59243774,\"market_cap\":null,\"overlap_theme_count\":1,\"positive_contribution_ratio\":0.36181541859646427,\"rel_spy_4w\":0.06196177545498971,\"return_4w\":0.06366476236045426,\"role\":\"core\",\"ticker\":\"LEU\",\"valid\":true},{\"dollar_volume_20d\":381646116.08703613,\"market_cap\":null,\"overlap_theme_count\":1,\"positive_contribution_ratio\":0.0,\"rel_spy_4w\":-0.26137884455594707,\"return_4w\":-0.2596758576504825,\"role\":\"peripheral\",\"ticker\":\"OKLO\",\"valid\":true},{\"dollar_volume_20d\":250664637.8690958,\"market_cap\":null,\"overlap_theme_count\":1,\"positive_contribution_ratio\":0.0,\"rel_spy_4w\":-0.17214629796509917,\"return_4w\":-0.17044331105963462,\"role\":\"peripheral\",\"ticker\":\"SMR\",\"valid\":true},{\"dollar_volume_20d\":632520059.4140625,\"market_cap\":null,\"overlap_theme_count\":2,\"positive_contribution_ratio\":0.0,\"rel_spy_4w\":-0.03415271987666235,\"return_4w\":-0.0324497329711978,\"role\":\"beneficiary\",\"ticker\":\"VST\",\"valid\":true}],\"display_name\":\"原子力・ウラン\",\"metrics\":{\"above_50dma_count\":1,\"advance_count_4w\":2,\"advance_ratio_4w\":0.2857142857142857,\"contribution_hhi\":0.5381899570753408,\"effective_contributor_count\":1.8580800084681082,\"equal_weight_led\":null,\"equal_weight_rel_spy_13w\":-0.2830572334388303,\"equal_weight_rel_spy_1w\":-0.02530066661266718,\"equal_weight_rel_spy_4w\":-0.07582722095710501,\"equal_weight_rel_spy_previous_3w\":-0.04067070989529913,\"equal_weight_rel_spy_previous_9w\":-0.22948934406696836,\"equal_weight_return_13w\":-0.24090297079379036,\"equal_weight_return_1w\":-0.014338820833796688,\"equal_weight_return_4w\":-0.07412423405164045,\"liquidity_weight_rel_spy_4w\":-0.052217408191476807,\"market_cap_led\":null,\"market_cap_weight_rel_spy_4w\":null,\"median_rel_spy_4w\":-0.11475363076244272,\"pct_above_50dma\":0.14285714285714285,\"pct_within_5pct_52w_high\":0.0,\"single_name_concentrated\":true,\"top1_contribution_ratio\":0.6381845814035357,\"top3_contribution_ratio\":1.0,\"unique_constituent_count\":7,\"volume_ratio_20d_60d\":0.8841947221649732,\"weighting_divergence_4w\":null,\"winsorized_equal_weight_rel_spy_4w\":-0.06984098503624547},\"quality\":{\"classification_eligible\":true,\"constituent_count\":7,\"coverage_ratio\":1.0,\"direction_eligible\":false,\"evidence_eligible\":true,\"history_weeks\":1,\"metric_valid_counts\":{\"above_50dma\":7,\"market_cap\":0,\"return_13w\":7,\"return_4w\":7,\"within_5pct_52w_high\":7},\"missing_required_fields\":[],\"phase_initial_diffusion_eligible\":false,\"phase_overheat_eligible\":true,\"quality_reasons\":[\"Q_HISTORY_BELOW_3\",\"Q_MARKET_CAP_COVERAGE_BELOW_075\"],\"role_valid_counts\":{\"beneficiary\":2,\"core\":3,\"peripheral\":2},\"valid_constituent_count\":7},\"theme_id\":\"nuclear_uranium\"},{\"constituents\":[{\"dollar_volume_20d\":60753093.57475281,\"market_cap\":null,\"overlap_theme_count\":1,\"positive_contribution_ratio\":null,\"rel_spy_4w\":-0.27058649756492603,\"return_4w\":-0.2688835106594615,\"role\":\"peripheral\",\"ticker\":\"ACLS\",\"valid\":true},{\"dollar_volume_20d\":4601152503.897705,\"market_cap\":null,\"overlap_theme_count\":1,\"positive_contribution_ratio\":null,\"rel_spy_4w\":-0.2217640792633031,\"return_4w\":-0.22006109235783855,\"role\":\"core\",\"ticker\":\"AMAT\",\"valid\":true},{\"dollar_volume_20d\":3482383117.897339,\"market_cap\":null,\"overlap_theme_count\":1,\"positive_contribution_ratio\":null,\"rel_spy_4w\":-0.11669413036275456,\"return_4w\":-0.11499114345729,\"role\":\"core\",\"ticker\":\"ASML\",\"valid\":true},{\"dollar_volume_20d\":2621722623.4253693,\"market_cap\":null,\"overlap_theme_count\":1,\"positive_contribution_ratio\":null,\"rel_spy_4w\":-0.3149003059352764,\"return_4w\":-0.31319731902981185,\"role\":\"core\",\"ticker\":\"KLAC\",\"valid\":true},{\"dollar_volume_20d\":3676480682.478943,\"market_cap\":null,\"overlap_theme_count\":1,\"positive_contribution_ratio\":null,\"rel_spy_4w\":-0.25278926789493106,\"return_4w\":-0.2510862809894665,\"role\":\"core\",\"ticker\":\"LRCX\",\"valid\":true},{\"dollar_volume_20d\":330319059.5541382,\"market_cap\":null,\"overlap_theme_count\":1,\"positive_contribution_ratio\":null,\"rel_spy_4w\":-0.2657626483562795,\"return_4w\":-0.26405966145081494,\"role\":\"beneficiary\",\"ticker\":\"ONTO\",\"valid\":true},{\"dollar_volume_20d\":1353256970.0236511,\"market_cap\":null,\"overlap_theme_count\":1,\"positive_contribution_ratio\":null,\"rel_spy_4w\":-0.1412873796785672,\"return_4w\":-0.13958439277310264,\"role\":\"beneficiary\",\"ticker\":\"TER\",\"valid\":true}],\"display_name\":\"半導体製造装置\",\"metrics\":{\"above_50dma_count\":0,\"advance_count_4w\":0,\"advance_ratio_4w\":0.0,\"contribution_hhi\":null,\"effective_contributor_count\":null,\"equal_weight_led\":null,\"equal_weight_rel_spy_13w\":0.027774522760727782,\"equal_weight_rel_spy_1w\":-0.057386466189348874,\"equal_weight_rel_spy_4w\":-0.2262549012937197,\"equal_weight_rel_spy_previous_3w\":-0.07685561477776916,\"equal_weight_rel_spy_previous_9w\":0.19348356264457017,\"equal_weight_return_13w\":0.06992878540576775,\"equal_weight_return_1w\":-0.04642462041047838,\"equal_weight_return_4w\":-0.22455191438825514,\"liquidity_weight_rel_spy_4w\":-0.215621296505485,\"market_cap_led\":null,\"market_cap_weight_rel_spy_4w\":null,\"median_rel_spy_4w\":-0.25278926789493106,\"pct_above_50dma\":0.0,\"pct_within_5pct_52w_high\":0.0,\"single_name_concentrated\":null,\"top1_contribution_ratio\":null,\"top3_contribution_ratio\":null,\"unique_constituent_count\":7,\"volume_ratio_20d_60d\":0.9021041342085818,\"weighting_divergence_4w\":null,\"winsorized_equal_weight_rel_spy_4w\":-0.22343767857164284},\"quality\":{\"classification_eligible\":true,\"constituent_count\":7,\"coverage_ratio\":1.0,\"direction_eligible\":false,\"evidence_eligible\":true,\"history_weeks\":1,\"metric_valid_counts\":{\"above_50dma\":7,\"market_cap\":0,\"return_13w\":7,\"return_4w\":7,\"within_5pct_52w_high\":7},\"missing_required_fields\":[],\"phase_initial_diffusion_eligible\":false,\"phase_overheat_eligible\":true,\"quality_reasons\":[\"Q_HISTORY_BELOW_3\",\"Q_ROLE_PERIPHERAL_BELOW_2\",\"Q_MARKET_CAP_COVERAGE_BELOW_075\"],\"role_valid_counts\":{\"beneficiary\":2,\"core\":4,\"peripheral\":1},\"valid_constituent_count\":7},\"theme_id\":\"semi_equipment\"}],\"unresolved_factual_questions\":[]}",
  "fragment_byte_length": 7786,
  "fragment_sha256": "0c5c8911b68d16877b140b1927eee03f7c82fbb7d4b00605de00d76e9da206ba"
}
