{
  "consumer_contract_version": "4.0",
  "chunk_version": "1.0",
  "generation_id": "6c2260ba8b98d8fccd20d14e35fb616ff40e1d7bc1d7af296cf514e962deffa0",
  "package": "reconciliation-handoff",
  "part": 2,
  "part_count": 3,
  "fragment": "me_id\":\"defense\"},{\"candidate_bucket\":\"avoid_now\",\"fundamental_confirmation\":null,\"fundamental_gate\":{\"missing_fields\":[\"fundamental_confirmation\"],\"reason_code\":\"FUNDAMENTAL_CONFIRMATION_MISSING\",\"status\":\"not_evaluable\"},\"hard_exclusion\":true,\"hard_exclusion_reason\":\"avoid_now\",\"machine_reason_components\":{\"condition_flags\":{\"broad_concentration_pass\":false,\"contrary_evidence\":[\"CONCENTRATION_SINGLE_NAME\",\"ROLE_CORE_NOT_ADVANCING\"],\"direction_improving\":null,\"direction_outflow_signal\":null,\"direction_worsening\":null,\"matched_conditions\":[\"P5_REL_ALL_NONPOSITIVE\",\"CONCENTRATION_TOP1_GT_60\"],\"overheat_breadth_weak\":false,\"phase_diffusion\":null,\"phase_initial\":null,\"phase_price_overheat\":false,\"unmatched_conditions\":[]},\"decision\":{\"analysis_mode\":\"initial_observation\",\"candidate_bucket\":\"avoid_now\",\"direct_flow_confirmation\":\"unavailable\",\"price_preference\":\"negative\",\"time_profile\":\"mixed\",\"weeks_until_trend\":2},\"quality\":{\"classification_eligible\":true,\"constituent_count\":8,\"coverage_ratio\":1.0,\"direction_eligible\":false,\"evidence_eligible\":true,\"history_weeks\":1,\"metric_valid_counts\":{\"above_50dma\":8,\"market_cap\":0,\"return_13w\":8,\"return_4w\":8,\"within_5pct_52w_high\":8},\"missing_required_fields\":[],\"phase_initial_diffusion_eligible\":false,\"phase_overheat_eligible\":true,\"quality_reasons\":[\"Q_HISTORY_BELOW_3\",\"Q_MARKET_CAP_COVERAGE_BELOW_075\"],\"role_valid_counts\":{\"beneficiary\":3,\"core\":3,\"peripheral\":2},\"valid_constituent_count\":8}},\"mechanical_priority\":\"watch\",\"mechanical_rank\":4,\"monitoring_status\":\"excluded\",\"price_confirmation\":{\"breadth_gate\":{\"missing_fields\":[],\"observed_values\":{\"advance_ratio_4w\":0.25,\"pct_above_50dma\":0.125},\"reason_code\":\"BREADTH_BELOW_THRESHOLD\",\"required_operator\":\">= for both\",\"required_values\":{\"advance_ratio_4w\":0.6,\"pct_above_50dma\":0.5},\"status\":\"fail\"},\"breadth_pass\":false,\"data_available\":true,\"missing_fields\":[],\"quality_gate\":{\"missing_fields\":[],\"observed_value\":true,\"reason_code\":\"PASS\",\"required_operator\":\"is\",\"required_value\":true,\"status\":\"pass\"},\"quality_pass\":true,\"relative_gate\":{\"difference\":-0.11725058965547462,\"missing_fields\":[],\"observed_value\":-0.06725058965547462,\"reason_code\":\"RELATIVE_BELOW_THRESHOLD\",\"required_operator\":\">=\",\"required_value\":0.05,\"status\":\"fail\"},\"relative_threshold_pass\":false,\"status\":\"fail\"},\"selection_eligible\":false,\"selection_gate_reasons\":[\"HARD_EXCLUSION\",\"RELATIVE_RELATIVE_BELOW_THRESHOLD\",\"BREADTH_BREADTH_BELOW_THRESHOLD\",\"FUNDAMENTAL_FUNDAMENTAL_CONFIRMATION_MISSING\",\"CANDIDATE_BUCKET_AVOID_NOW\"],\"selection_gate_status\":\"fail\",\"theme_id\":\"dc_power_infra\"},{\"candidate_bucket\":\"avoid_now\",\"fundamental_confirmation\":null,\"fundamental_gate\":{\"missing_fields\":[\"fundamental_confirmation\"],\"reason_code\":\"FUNDAMENTAL_CONFIRMATION_MISSING\",\"status\":\"not_evaluable\"},\"hard_exclusion\":true,\"hard_exclusion_reason\":\"avoid_now\",\"machine_reason_components\":{\"condition_flags\":{\"broad_concentration_pass\":false,\"contrary_evidence\":[\"CONCENTRATION_SINGLE_NAME\",\"ROLE_CORE_NOT_ADVANCING\"],\"direction_improving\":null,\"direction_outflow_signal\":null,\"direction_worsening\":null,\"matched_conditions\":[\"P5_REL_ALL_NONPOSITIVE\",\"CONCENTRATION_TOP1_GT_60\"],\"overheat_breadth_weak\":false,\"phase_diffusion\":null,\"phase_initial\":null,\"phase_price_overheat\":false,\"unmatched_conditions\":[]},\"decision\":{\"analysis_mode\":\"initial_observation\",\"candidate_bucket\":\"avoid_now\",\"direct_flow_confirmation\":\"unavailable\",\"price_preference\":\"negative\",\"time_profile\":\"strengthening\",\"weeks_until_trend\":2},\"quality\":{\"classification_eligible\":true,\"constituent_count\":7,\"coverage_ratio\":1.0,\"direction_eligible\":false,\"evidence_eligible\":true,\"history_weeks\":1,\"metric_valid_counts\":{\"above_50dma\":7,\"market_cap\":0,\"return_13w\":7,\"return_4w\":7,\"within_5pct_52w_high\":7},\"missing_required_fields\":[],\"phase_initial_diffusion_eligible\":false,\"phase_overheat_eligible\":true,\"quality_reasons\":[\"Q_HISTORY_BELOW_3\",\"Q_MARKET_CAP_COVERAGE_BELOW_075\"],\"role_valid_counts\":{\"beneficiary\":2,\"core\":3,\"peripheral\":2},\"valid_constituent_count\":7}},\"mechanical_priority\":\"watch\",\"mechanical_rank\":5,\"monitoring_status\":\"excluded\",\"price_confirmation\":{\"breadth_gate\":{\"missing_fields\":[],\"observed_values\":{\"advance_ratio_4w\":0.2857142857142857,\"pct_above_50dma\":0.14285714285714285},\"reason_code\":\"BREADTH_BELOW_THRESHOLD\",\"required_operator\":\">= for both\",\"required_values\":{\"advance_ratio_4w\":0.6,\"pct_above_50dma\":0.5},\"status\":\"fail\"},\"breadth_pass\":false,\"data_available\":true,\"missing_fields\":[],\"quality_gate\":{\"missing_fields\":[],\"observed_value\":true,\"reason_code\":\"PASS\",\"required_operator\":\"is\",\"required_value\":true,\"status\":\"pass\"},\"quality_pass\":true,\"relative_gate\":{\"difference\":-0.12582722095710502,\"missing_fields\":[],\"observed_value\":-0.07582722095710501,\"reason_code\":\"RELATIVE_BELOW_THRESHOLD\",\"required_operator\":\">=\",\"required_value\":0.05,\"status\":\"fail\"},\"relative_threshold_pass\":false,\"status\":\"fail\"},\"selection_eligible\":false,\"selection_gate_reasons\":[\"HARD_EXCLUSION\",\"RELATIVE_RELATIVE_BELOW_THRESHOLD\",\"BREADTH_BREADTH_BELOW_THRESHOLD\",\"FUNDAMENTAL_FUNDAMENTAL_CONFIRMATION_MISSING\",\"CANDIDATE_BUCKET_AVOID_NOW\"],\"selection_gate_status\":\"fail\",\"theme_id\":\"nuclear_uranium\"},{\"candidate_bucket\":\"watch_recovery\",\"fundamental_confirmation\":null,\"fundamental_gate\":{\"missing_fields\":[\"fundamental_confirmation\"],\"reason_code\":\"FUNDAMENTAL_CONFIRMATION_MISSING\",\"status\":\"not_evaluable\"},\"hard_exclusion\":false,\"hard_exclusion_reason\":null,\"machine_reason_components\":{\"condition_flags\":{\"broad_concentration_pass\":false,\"contrary_evidence\":[\"CONCENTRATION_SINGLE_NAME\",\"ROLE_CORE_NOT_ADVANCING\"],\"direction_improving\":null,\"direction_outflow_signal\":null,\"direction_worsening\":null,\"matched_conditions\":[\"CONCENTRATION_TOP1_GT_60\"],\"overheat_breadth_weak\":null,\"phase_diffusion\":null,\"phase_initial\":null,\"phase_price_overheat\":null,\"unmatched_conditions\":[]},\"decision\":{\"analysis_mode\":\"initial_observation\",\"candidate_bucket\":\"watch_recovery\",\"direct_flow_confirmation\":\"unavailable\",\"price_preference\":\"negative\",\"time_profile\":\"weakening\",\"weeks_until_trend\":2},\"quality\":{\"classification_eligible\":true,\"constituent_count\":8,\"coverage_ratio\":1.0,\"direction_eligible\":false,\"evidence_eligible\":true,\"history_weeks\":1,\"metric_valid_counts\":{\"above_50dma\":8,\"market_cap\":0,\"return_13w\":8,\"return_4w\":8,\"within_5pct_52w_high\":8},\"missing_required_fields\":[],\"phase_initial_diffusion_eligible\":false,\"phase_overheat_eligible\":true,\"quality_reasons\":[\"Q_HISTORY_BELOW_3\",\"Q_ROLE_PERIPHERAL_BELOW_2\",\"Q_MARKET_CAP_COVERAGE_BELOW_075\"],\"role_valid_counts\":{\"beneficiary\":2,\"core\":5,\"peripheral\":1},\"valid_constituent_count\":8}},\"mechanical_priority\":\"watch\",\"mechanical_rank\":6,\"monitoring_status\":\"recovery_monitoring\",\"price_confirmation\":{\"breadth_gate\":{\"missing_fields\":[],\"observed_values\":{\"advance_ratio_4w\":0.25,\"pct_above_50dma\":0.0},\"reason_code\":\"BREADTH_BELOW_THRESHOLD\",\"required_operator\":\">= for both\",\"required_values\":{\"advance_ratio_4w\":0.6,\"pct_above_50dma\":0.5},\"status\":\"fail\"},\"breadth_pass\":false,\"data_available\":true,\"missing_fields\":[],\"quality_gate\":{\"missing_fields\":[],\"observed_value\":true,\"reason_code\":\"PASS\",\"required_operator\":\"is\",\"required_value\":true,\"status\":\"pass\"},\"quality_pass\":true,\"relative_gate\":{\"difference\":-0.19307385479027228,\"missing_fields\":[],\"observed_value\":-0.1430738547902723,\"reason_code\":\"RELATIVE_BELOW_THRESHOLD\",\"required_operator\":\">=\",\"required_value\":0.05,\"status\":\"fail\"},\"relative_threshold_pass\":false,\"status\":\"fail\"},\"selection_eligible\":false,\"selection_gate_reasons\":[\"RELATIVE_RELATIVE_BELOW_THRESHOLD\",\"BREADTH_BREADTH_BELOW_THRESHOLD\",\"FUNDAMENTAL_FUNDAMENTAL_CONFIRMATION_MISSING\",\"WATCH_RECOVERY\"],\"selection_gate_status\":\"fail\",\"theme_id\":\"ai_semis\"},{\"candidate_bucket\":\"avoid_now\",\"fundamental_confirmation\":null,\"fundamental_gate\":{\"missing_fields\":[\"fundamental_confirmation\"],\"reason_code\":\"FUNDAMENTAL_CONFIRMATION_MISSING\",\"status\":\"not_evaluable\"},\"hard_exclusion\":true,\"hard_exclusion_reason\":\"avoid_now\",\"machine_reason_components\":{\"condition_flags\":{\"broad_concentration_pass\":false,\"contrary_evidence\":[\"CONCENTRATION_SINGLE_NAME\",\"ROLE_CORE_NOT_ADVANCING\"],\"direction_improving\":null,\"",
  "fragment_byte_length": 8192,
  "fragment_sha256": "c41f2b35842ebe4f3c65ff29632560be72bc5a81dadb25acfef506db90925783"
}
